{
  "schemaVersion": 1,
  "zoneId": "zone-a",
  "coordinateSystem": "arkit-world-meters",
  "capturedAt": "2026-10-02T00:00:00Z",
  "roomIdentifier": "00000000-0000-0000-0000-000000000000",
  "story": 0,
  "walls": [
    {
      "identifier": "11111111-1111-1111-1111-111111111111",
      "category": "wall",
      "confidence": "high",
      "story": 0,
      "dimensions": [4.0, 2.4, 0.1],
      "position": [0.0, 1.2, -2.0],
      "transformColumnMajor": [1, 0, 0, 0, 0, 1, 0, 0, 0, 0, 1, 0, 0, 1.2, -2, 1],
      "polygonCorners": [],
      "parentIdentifier": null
    }
  ],
  "doors": [
    {
      "identifier": "22222222-2222-2222-2222-222222222222",
      "category": "door-open",
      "confidence": "high",
      "story": 0,
      "dimensions": [0.9, 2.1, 0.1],
      "position": [1.5, 1.05, -4.0],
      "transformColumnMajor": [1, 0, 0, 0, 0, 1, 0, 0, 0, 0, 1, 0, 1.5, 1.05, -4, 1],
      "polygonCorners": [],
      "parentIdentifier": "11111111-1111-1111-1111-111111111111"
    }
  ],
  "openings": [],
  "windows": [],
  "floors": [
    {
      "identifier": "33333333-3333-3333-3333-333333333333",
      "category": "floor",
      "confidence": "high",
      "story": 0,
      "dimensions": [6.0, 0.05, 8.0],
      "position": [0.0, 0.0, -4.0],
      "transformColumnMajor": [1, 0, 0, 0, 0, 1, 0, 0, 0, 0, 1, 0, 0, 0, -4, 1],
      "polygonCorners": [],
      "parentIdentifier": null
    }
  ],
  "objects": [
    {
      "identifier": "44444444-4444-4444-4444-444444444444",
      "category": "stairs",
      "confidence": "medium",
      "story": 0,
      "dimensions": [1.2, 3.0, 2.5],
      "position": [2.0, 1.5, -8.0],
      "transformColumnMajor": [1, 0, 0, 0, 0, 1, 0, 0, 0, 0, 1, 0, 2, 1.5, -8, 1],
      "parentIdentifier": null
    }
  ],
  "sections": [
    { "label": "livingRoom", "story": 0, "center": [0.0, 0.0, -3.0] }
  ],
  "notes": "Illustrative RoomPlan extract. Real files come from a LiDAR scan."
}
